id,title,description,term,department,level,sections,instructors,seats,open_seats,filled_seats,syllabus_count,term_cleaned
KNES389K,Topical Investigations; Kinesiology Internship,Prerequisite: permission of department.,202412,Kinesiology,Undergrad,0,NA,0,0,0,0,2024-12-01
KNES161N,Physical Education Activities: Coed; Conditioning (beginning),Students must pay a $40 instructional materials fee.,202412,Kinesiology,Undergrad,1,Emma Powell,50,0,50,0,2024-12-01
KNES462,Neural Basis of Human Movement,"Prerequisite: Minimum grade of C- in BSCI201, BSCI202, and KNES385; or permission of SPHL-Kinesiology department.
Restriction: Must have earned a minimum of 75 credits.",202412,Kinesiology,Undergrad,1,Rodolphe Gentili,30,10,20,0,2024-12-01
KNES287,Sport and American Society,Recommended: Minimum grade of C- in KNES285.,202412,Kinesiology,Undergrad,1,Ronald Mower,30,15,15,1,2024-12-01
KNES643,Public Health & Physical Activity in the Classroom,"Recommended: KNES600.
Restriction: Must be in the Master of Public Health program; or permission of the Kinesiology Department.",202412,Kinesiology,Grad,1,Valerie Cholet,20,17,3,0,2024-12-01
KNES799,Master's Thesis Research,NA,202412,Kinesiology,Grad,0,NA,0,0,0,0,2024-12-01
KNES487,"Women, Sports and Culture","Prerequisite: Minimum grade of C- in KNES287.
Restriction: Must be in a major within the SPHL-Kinesiology department; and must have earned a minimum of 75 credits.",202412,Kinesiology,Undergrad,1,Lauren Nowosatka,30,2,28,0,2024-12-01
KNES350,The Psychology of Sports & Exercise,Restriction: Must have earned a minimum of 45 credits.,202412,Kinesiology,Undergrad,1,J Carson Smith,30,17,13,3,2024-12-01
KNES370,Motor Development,Restriction: Must be in a major within SPHL-Kinesiology department.,202412,Kinesiology,Undergrad,1,Tim Kiemel,40,1,39,4,2024-12-01
KNES389,Topical Investigations,Prerequisite: permission of department.,202412,Kinesiology,Undergrad,0,NA,0,0,0,2,2024-12-01
LARC799,Master's Thesis Research,NA,202412,Landscape Architecture,Grad,0,NA,0,0,0,0,2024-12-01
LARC453,Introduction to GIS and Hydrologic Modeling,"Introduction to Geographic Information Systems (GIS) and their application to hydrologic modeling. Basic GIS skills are used to manipulate and analyze spatial data to populate NRCS TR-55 hydrologic model for use in sizing constructed wetlands, bio-retention cells, and minor flood zones. No prior knowledge of GIS or hydrologic modeling is required. Stormwater and erosion control permitting as well as basic design principles for Maryland Environmental Site Design standards are introduced.",202412,Landscape Architecture,Undergrad,1,Christopher Ellis,20,1,19,0,2024-12-01
LARC151,Urban Agriculture: Designing and Assessing Edible Landscapes,"Students will examine the growing development of urban agriculture and edible landscapes. Urban agriculture has seen a recent growth and interest in cities across the globe. From Paris to New York, from Baltimore to Detroit, urban agriculture is an emerging land use to address a variety of needs. Redevelopment, food deserts, community engagement and environmental justice are just some of the issues and topics that are connected to the recent growth of urban agriculture. This course will take a critical examination of urban agriculture's contribution to the food system, its input and outputs in the urban landscape, and the planning and design of urban agriculture and edible landscapes.",202412,Landscape Architecture,Undergrad,1,Sherry Russell,25,10,15,1,2024-12-01
LARC699,Independent Studies in Landscape and Architecture,NA,202412,Landscape Architecture,Grad,0,NA,0,0,0,0,2024-12-01
LARC162,"Environmental Justice: Same World, Different Built Environment","Environmental Justice will be explored in the context of the built environment. What unequal public built environmental threats exist? How can these threats be prevented or eliminated? Public schools, public parks, access to clean water, air pollution, tree coverage are among the built environments examined in the course.",202412,Landscape Architecture,Undergrad,1,Dora Cortez; Byoung-Suk Kweon,20,1,19,0,2024-12-01
LARC421,Computer-Aided Design and Drafting (CADD): Urban Construction,"Credit only granted for: LARC489O or LARC421.
Formerly: LARC489O.",202412,Landscape Architecture,Undergrad,1,Christopher Ellis,25,10,15,0,2024-12-01
LARC499,Independent Studies in Landscape Architecture; Independent Studies in Landscape Architecture,NA,202412,Landscape Architecture,Undergrad,0,NA,0,0,0,0,2024-12-01
CMSC388B,Special Topics in Computer Science; Introduction to Web Application Back End Development,"Prerequisite: CMSC330. Restriction: permission of department.

Questions about the course should be directed to Andrej Rasevic at arasevic@cs.umd.edu",202412,Computer Science,Undergrad,1,Alan Sussman,100,60,40,0,2024-12-01
CMSC799,Master's Thesis Research,NA,202412,Computer Science,Grad,0,NA,0,0,0,0,2024-12-01
CMSC798,Master's Non-Thesis Research,NA,202412,Computer Science,Grad,0,NA,0,0,0,0,2024-12-01
CMSC398B,Special Topics in Computer Science; Introduction to Go,"Prerequisite: CMSC216. Restriction: permission of department.

This course will introduce students to important topics in distributed systems programming, programmed using the Go programming language. Topics include JSON over HTTP services, protocol buffers, gRPC, service discovery and load balancing, and Kubernetes. Coursework will involve programming problems and exam-based assessments.

Questions about the course should be directed to Andrej Rasevic at arasevic@cs.umd.edu",202412,Computer Science,Undergrad,1,Peter Keleher,40,20,20,0,2024-12-01
CMSC499A,Independent Undergraduate Research,NA,202412,Computer Science,Undergrad,0,NA,0,0,0,0,2024-12-01
CMSC398O,Special Topics in Computer Science; Tools for Leveraging Generative AI,"Prerequisite: Minimum grade of C- in CMSC132. Intermediate Python programming experience and basic familiarity with general APIs and Large Language Models (LLMs) is required. Please contact the instructor if you have any questions about whether you meet these prerequisites.

Course description: In this course we will learn how to leverage LLM applications. We will cover tools like Langchain, Gradio, streamlit, weights and biases, etc.",202412,Computer Science,Undergrad,1,Mohammad Nayeem Teli,40,2,38,0,2024-12-01
CMSC898,Pre-Candidacy Research,NA,202412,Computer Science,Grad,0,NA,0,0,0,0,2024-12-01
CMSC899,Doctoral Dissertation Research,NA,202412,Computer Science,Grad,0,NA,0,0,0,0,2024-12-01
CMSC388A,Special Topics in Computer Science; Introduction to Web Application Front End Development,"Prerequisite: CMSC330. Restriction: permission of department.

Questions about the course should be directed to Andrej Rasevic at arasevic@cs.umd.edu",202412,Computer Science,Undergrad,1,Alan Sussman,100,69,31,0,2024-12-01
CMSC498A,Selected Topics in Computer Science,NA,202412,Computer Science,Undergrad,0,NA,0,0,0,0,2024-12-01
CLFS609F,Special Topics; Principles of Paleobiology,Must be in the Master of Chemical and Life Sciences program. All other graduate students must request permission. Contact exst@umd.edu. Golden ID students are not eligible for this course.,202412,Chemical and Life Sciences,Grad,1,Bretton Kent,15,15,0,0,2024-12-01
CLFS609K,Special Topics; Current Topics in Biomedical Research,Must be in the Master of Chemical and Life Sciences program. All other graduate students must request permission. Contact exst@umd.edu. Golden ID students are not eligible for this course.,202412,Chemical and Life Sciences,Grad,1,Cristina Banuelos,5,5,0,0,2024-12-01
CLFS608A,Seminar in Current Topics in Chemical and Life Science; Independent Research,Contact Dr. Joelle Presson (mclfs@umd.edu) to establish a mentor and then contact exst@umd.edu to register. Golden ID students are not eligible for this course.,202412,Chemical and Life Sciences,Grad,0,NA,0,0,0,0,2024-12-01
CLFS725,Experimental Design,"Credit only granted for: LFSC710, LFSC719, or LFSC725.
Formerly: LFSC719.",202412,Chemical and Life Sciences,Grad,1,Bretton Kent,20,17,3,0,2024-12-01
CLFS609B,Special Topics; The Biology of Reproduction,Must be in the Master of Chemical and Life Sciences program. All other graduate students must request permission. Contact exst@umd.edu. Golden ID students are not eligible for this course.,202412,Chemical and Life Sciences,Grad,1,Janet Norcross,15,13,2,0,2024-12-01
CLFS608,Seminar in Current Topics in Chemical and Life Science,Contact Dr. Joelle Presson (mclfs@umd.edu) to establish a mentor and then contact exst@umd.edu to register. Golden ID students are not eligible for this course.,202412,Chemical and Life Sciences,Grad,0,NA,0,0,0,0,2024-12-01
CLFS619A,Special Topics in Chemistry; Molecular Spectroscopy,Must be in the Master of Chemical and Life Sciences program. All other graduate students must request permission. Contact exst@umd.edu. Golden ID students are not eligible for this course.,202412,Chemical and Life Sciences,Grad,1,Marjan Alaghmand,15,14,1,0,2024-12-01
BCHM677,Computational Tools in Biochemistry,"Prerequisite: BCHM674 or BCHM671; or permission of instructor.
Restriction: Must be in one of the following programs (Biochemistry (Master's); Biochemistry (Doctoral)) ; or permission of instructor.",202412,Biochemistry,Grad,1,Paul Paukstelis,20,13,7,0,2024-12-01
ARHU298L,"""Are you - Nobody - too?"" Why we create and share stories, poems, comics and zines","Our ability to create and maintain meaningful social connections tells us that we are not alone; it reminds us that we are connected to something larger, a community, a group of people willing to celebrate our triumphs and help us cope during difficult times. Emphasizing the principles of participation, connection, and collaboration, this course explores how various traditionally marginalized people form their own cultural communities and develop a sense of reciprocal belonging through the creation (and independent distribution) of stories, poems, spoken word poetry, comics and zines.In spite of intersectional obstacles such as the lack of political power, access to resources and economic opportunities, these communities may find it possible to redefine their place in society by demonstrating originality, resilience, and talent.",202412,Arts and Humanities,Undergrad,1,Oludolapo Demuren,20,14,6,0,2024-12-01
ARHU230,"Introduction to Humanities, Health, and Medicine","Restriction: Permission of ARHU-English Department.
Cross-listed with: ENGL254, HIST219N, WGSS230.
Credit only granted for: ARHU230 , ENGL289C, ENGL254, ARHU298A, HIST219N, or WGSS230.",202412,Arts and Humanities,Undergrad,1,Daniel Richter,20,0,20,0,2024-12-01
BMGT899,Doctoral Dissertation Research,NA,202412,Business and Management,Grad,0,NA,0,0,0,0,2024-12-01
BMGT380,Business Law I,"Legal aspects of business relationships. Examination of torts and business crimes, contracts and agency. The law of personal property and bailment relationships. Survey of public policy issues.",202412,Business and Management,Undergrad,1,Gideon Mark,50,0,50,23,2024-12-01
BMGT230,Business Statistics,"Prerequisite: MATH113 or MATH115; or must have math eligibility of MATH120 or higher.
Restriction: Must not have completed ENCE302, ENME392, STAT400, BMGT231, or ENEE324.",202412,Business and Management,Undergrad,2,Jiannan Xu; Eunseong Jang,50,6,44,7,2024-12-01
BMGT898,Pre-Candidacy Research,NA,202412,Business and Management,Grad,1,Instructor: TBA,5,5,0,0,2024-12-01
BMGT364,Managing People and Organizations,"An introduction to selected aspects of human behavior in organizations generally known as organizational behavior (OB). This course is designed to help students develop systematic and fundamental understanding of people and their behaviors in organizations, as well as useful abilities and skills required to effectively and ethically manage various individual, interpersonal, group, and organization-level processes.",202412,Business and Management,Undergrad,1,Amber Johnson,55,6,49,4,2024-12-01
BMGT221,Principles of Accounting II,Prerequisite: BMGT220.,202412,Business and Management,Undergrad,1,Michael McMillan,45,16,29,6,2024-12-01
BMGT220,Principles of Accounting I,Basic theory and techniques of contemporary financial accounting. Includes the accounting cycle and the preparation of financial statements for single owner and partnership forms of business organizations operating as service companies or merchandisers.,202412,Business and Management,Undergrad,1,Yang Liu,45,5,40,5,2024-12-01
BMGT289I,Why Good Managers Make Bad Decisions,"This course provides an overview of the concepts, approaches, and vocabulary of evidence-based management (EBM) and provides an understanding of how experts in many disciplines can employ evidenced based decision making. EBM is an emerging movement in business to explicitly use the current best information in management decision making with special emphasis on relevant scientific findings and unbiased organizational facts. The course stresses how individuals practicing EBM learn how to rethink their approaches to data and knowledge in order to make more effective decisions.",202412,Business and Management,Undergrad,1,Jeff Miller,25,0,25,1,2024-12-01
BMGT110,Introduction to the Business Value Chain,"Students are provided with an introduction to the business value chain with an emphasis on inter-organizational and intra-organizational coordination of core business processes. Emphasis is on cross-functional integration and the efficient and effective management of core processes with an emphasis on marketing, operations and supply chain management.",202412,Business and Management,Undergrad,1,Jeffrey Mund,40,21,19,14,2024-12-01
BMGT758K,Special Topics in Business and Management; Organizational Change,Cross-listed with BUSI718C. Credit only granted for BUSI718C or BMGT758K.,202412,Business and Management,Grad,2,Sheetal Singh; Myeong-Gu Seo,8,3,5,0,2024-12-01
BMGT758J,Special Topics in Business and Management; International Business,Credit only granted for BUSI718B or BMGT758J.,202412,Business and Management,Grad,2,Jonathan Crocker,8,2,6,1,2024-12-01
BMGT828,Independent Study in Business and Management,NA,202412,Business and Management,Grad,1,Instructor: TBA,5,5,0,0,2024-12-01
BMGT395,Principles of Management for Non Business Majors,"Restriction: Must not have completed BMGT364; and must not be a major in the Robert H. Smith School of Business.
Credit only granted for: BMGT395 or BMGT364.
Additional information: Course does not apply to a Smith School degree. Course may be substituted by BMGT364 for General Business minor students only.",202412,Business and Management,Undergrad,1,Nicole Coomber,50,13,37,1,2024-12-01
BMGT301,Introduction to Information Systems,"Restriction: Must be in a major in BMGT-Robert H. Smith School of Business.
Additional information: CMSC majors will not receive credit for this course towards their upper level concentration in their CMSC major. All BMGT majors, including students who are a double major in CMSC, must complete BMGT301 for their BMGT degree.",202412,Business and Management,Undergrad,1,Zeinab Karake,40,1,39,1,2024-12-01
ECON644,Empirical Analysis II: Introduction to Economic Models,Prerequisite: ECON643.,202412,Economics,Grad,1,Razvan Vlaicu,23,11,12,0,2024-12-01
ECON306,Intermediate Microeconomic Theory & Policy,"Prerequisite: Minimum grade of C- in ECON200 and ECON201; and 1 course with a minimum grade of C- from (MATH120, MATH130, MATH136, MATH140).
Credit only granted for: ECON306, ECON326, AREC489M, or AREC326.",202412,Economics,Undergrad,1,Andrea Vilchez,65,12,53,21,2024-12-01
ECON330,Money and Banking,Prerequisite: Minimum grade of C- in ECON200 and ECON201.,202412,Economics,Undergrad,1,Giuliano Simoncelli,55,12,43,13,2024-12-01
ECON672,Program Analysis and Evaluation,Prerequisite: ECON641 and ECON645.,202412,Economics,Grad,1,Laura Kawano,23,10,13,1,2024-12-01
ECON414,Game Theory,"Prerequisite: 1 course with a minimum grade of C- from (ECON306, ECON326); and 1 course with a minimum grade of C- from (ECON230, BMGT230, ECON321, STAT401).
Restriction: Must be in one of the following programs (Economics Bachelor of Arts; Economics Bachelor of Science; Economics minor).
Credit only granted for: CMSC474, ECON414, GVPT399A or GVPT390.",202412,Economics,Undergrad,1,Ruibing Su,30,8,22,20,2024-12-01
ECON642,Topics in Applied Macroeconomics,Restriction: Must be in M.Prof.Studies: Applied Economics program; or permission of BSOS-Economics department.,202412,Economics,Grad,1,Samuel Rowe,23,4,19,2,2024-12-01
ECON675,Environmental Economics,Prerequisite: ECON641; and must have completed or be concurrently enrolled in ECON644.,202412,Economics,Grad,1,Paul Dockins; Charles Griffiths,23,20,3,0,2024-12-01
ECON898,Pre-Candidacy Research,NA,202412,Economics,Grad,0,NA,0,0,0,0,2024-12-01
ECON677,International Trade and Applications,"Prerequisite: ECON641 and ECON644.
Restriction: Must be in MS Applied Economics program; or with permission from the program director.",202412,Economics,Grad,1,Cristina Tello-Trillo,23,14,9,0,2024-12-01
ECON698,Selected Topics in Economics,NA,202412,Economics,Grad,0,NA,0,0,0,0,2024-12-01
ECON899,Doctoral Dissertation Research,NA,202412,Economics,Grad,0,NA,0,0,0,0,2024-12-01
ECON200,Principles of Microeconomics,"Prerequisite: MATH107 or MATH110; or must have math eligibility of MATH113 or higher.
Additional information: It is recommended that students complete ECON200 before taking ECON201.",202412,Economics,Undergrad,1,Luis Jaramillo,70,5,65,25,2024-12-01
ECON684,Applied Time Series Analysis and Forecasting,"Prerequisite: ECON642; and ECON645.
Restriction: Must be in M.Prof.Studies: Applied Economics program.",202412,Economics,Grad,1,Martin Stuermer,23,4,19,1,2024-12-01
ECON418M,Economic Development of Selected Areas; Middle East,"Prerequisites: 1 course with a minimum grade of C- from (ECON305, ECON306, ECON325, ECON326) and 1 course with a minimum grade of C- from (ECON230, BMGT230, ECON321). Restriction: Must be in Economics Bachelor of Arts program. Students may repeat ""ECON418 Economics Development of Selected Areas"" for a maximum of 6 credits.

Analyzes patterns of economic and institutional development in the Middle East; assesses the general trends in economic growth, investment, and institutional changes; and examines specific issues such as population and human development, economics and politics of oil and trade, the structure of state and its role in economic development, financial markets and Islamic banking, and business environment.",202412,Economics,Undergrad,1,Hossein Abbasi,30,10,20,5,2024-12-01
ECON201,Principles of Macroeconomics,"Prerequisite: MATH107 or MATH110; or must have math eligibility of MATH113 or higher.
Recommended: ECON200.
Credit only granted for: ECON201 or ECON205.",202412,Economics,Undergrad,1,Luying Yang,60,14,46,29,2024-12-01
ECON305,Intermediate Macroeconomic Theory and Policy,"Prerequisite: Minimum grade of C- in ECON200 and ECON201; and 1 course with a minimum grade of C- from (MATH120, MATH130, MATH136, MATH140).
Credit only granted for: ECON305 or ECON325.",202412,Economics,Undergrad,1,Lodovico Pizzati,50,22,28,23,2024-12-01
ENST389,Internship,NA,202412,Environmental Science and Technology,Undergrad,1,Jose-Luis Izursa,10,9,1,1,2024-12-01
ENST799,Master's Thesis Research,NA,202412,Environmental Science and Technology,Grad,1,Jose-Luis Izursa,2,2,0,0,2024-12-01
ENST499,Special Topics in Environmental Science and Technology,NA,202412,Environmental Science and Technology,Undergrad,1,Jose-Luis Izursa,2,2,0,3,2024-12-01
BSST338A,"Special Topics in Terrorism Studies; Misinformation, Conspiracy Theories, and the Radicalization of Modern Societies",A comprehensive exploration into belief in mis/disinformation and conspiracy theories that is instrumental in understanding radicalization in modern societies.,202412,Terrorism Studies,Undergrad,1,Berkay Erdemandi,25,15,10,1,2024-12-01
BSST338V,"Special Topics in Terrorism Studies; Al-Qaeda, the Islamic State, and Global Jihadist Movements","This course provides a comprehensive look at global jihadist movements, with specific focus on the groups Al-Qaeda and the Islamic State. At the completion of this course, students will have an in-depth understanding of historical and contemporary jihadist movements and a better understanding of tools to counter such groups.",202412,Terrorism Studies,Undergrad,1,Jason Blazakis,25,18,7,1,2024-12-01
BSST399N,Individual Study in Terrorism Studies; Social Network Analysis for Terrorism,"Social networks are connections between nodes (actors) and links (connections between nodes). Social network analysis (SNA) is a process of studying those nodes and links with a systematic, quantitative approach to better understand how networks are constructed, what networks are capable of, and how networks can be disrupted. This course covers SNA using UCINET, a popular SNA tool to systematically understand terrorist connections in such way that allows for informed decisions on terrorist network disruption.",202412,Terrorism Studies,Undergrad,1,Michael Egnoto,25,10,15,0,2024-12-01
WGSS326,Biology of Reproduction,"Prerequisite: BSCI170 and BSCI171; or BSCI105; or permission of the Harriet Tubman Department of Women, Gender, and Sexuality Studies; or permission of CMNS-Biological Sciences UG Program.
Cross-listed with: BSCI342.
Credit only granted for: BSCI342, WMST326 or WGSS326.
Formerly: WMST326.",202412,"Women, Gender, and Sexuality Studies",Undergrad,1,Justicia Opoku-Edusei,30,29,1,0,2024-12-01
FMSC340,Mental Health and Healing in Families,"Using an interdisciplinary approach to study mental health, mental wellness, and substance use, we will answer questions such as: How has our understanding and treatment of mental health changed throughout history? What are the current prevalence patterns and risk factors associated with mental health conditions? What is the prevention to postvention continuum? What is the role of relationships, families, and communities in addressing mental health? How do we diagnose and treat various mental health disorders using the best available research? And, what are the various mental health disciplines and how do they differ? This course is designed to examine mental health issues across the life course. We will explore the influence of social contexts, including racism and additional forms of othering, on mental health and wellness, and introduce the health systems that support mental health prevention and treatment.",202412,Family Science,Undergrad,1,Lauren Messina,40,11,29,0,2024-12-01
FMSC399,Independent Study,NA,202412,Family Science,Undergrad,0,NA,0,0,0,0,2024-12-01
FMSC789,Non-Thesis Research,NA,202412,Family Science,Grad,21,Mariana Falconier; Kevin Roy; Elise Resnick; Rabiatu Barrie; Jinhee Kim; Christine Schull; Tiara Fennell; Elisabeth Maring; Kerry Tripp; Erica Turner; Mia Smith-Bynum; Mona Mittal; Ghaffar Hurtado Choque; Manouchehr Mokhtari; Jessica Fish; Amy Morgan; Amy Lewin; Sandra Quinn; Julia Steinberg; Marie Thoma; Edmond Shenassa,210,208,2,0,2024-12-01
FMSC654,Clinical Marriage and Family Therapy Practice,"Prerequisite: FMSC651.
Restriction: Must be in Couple and Family Therapy (Master's) program.",202412,Family Science,Grad,1,Tiara Fennell,15,7,8,0,2024-12-01
FMSC341,Personal and Family Finance,"Credit only granted for: FMSC341 or FMST341.
Formerly: FMST341.",202412,Family Science,Undergrad,1,Manouchehr Mokhtari,30,11,19,1,2024-12-01
FMSC632,Testing and Assessment in Couple and Family Therapy,"Restriction: Permission of the Family Science department.
Credit only granted for: FMSC698T or FMSC632.
Formerly: FMSC698T.",202412,Family Science,Grad,1,Diana Mayer,20,12,8,0,2024-12-01
FMSC698V,Advanced Topics in Family Science; Violence in Families,NA,202412,Family Science,Grad,1,Christine Schull,15,6,9,2,2024-12-01
FMSC111,Credit Cards and College Students,"Recommended: Moderate level of computer literacy, especially Internet and ELMS. Reliable computer and Internet access.
Credit only granted for: FMSC111, FMSC341 or FMSC498D.
Formerly: FMSC498D.",202412,Family Science,Undergrad,1,Jesse Ketterman,45,3,42,1,2024-12-01
FMSC310,"Maternal, Child and Family Health","Credit only granted for: FMSC310, FMSC410 or FMSC498A.
Formerly: FMSC498A and FMSC410.
Additional information: A comprehensive understanding of maternal, child, and family health, with additional emphasis on environmental health, needs assessment and evaluation, enabling students to more effectively address issues in the workplace.",202412,Family Science,Undergrad,1,Edmond Shenassa,40,28,12,1,2024-12-01
FMSC330,Family Health: Health Happens in Families,Restriction: Junior standing or higher.,202412,Family Science,Undergrad,1,Rabiatu Barrie,30,20,10,0,2024-12-01
FMSC799,Master's Thesis Research; Master Thesis Research,NA,202412,Family Science,Grad,0,NA,0,0,0,0,2024-12-01
FMSC260,"Couples, Marriage, and Families: Intimate Relationship Across the Life Course","Covers the different aspects of couple relationships and family life. This includes common problems in couple relationships, and resources to strengthen couple and family relationships. You will also learn about stages of relationships, theories of love and family, policy related to couples and family formation, and how research is conducted with couples and families. Together, we will discuss and explore issues that couples and families face in modern times and will consider how many of these issues have changed due to policy, technology, attitudes, and a variety of other societal factors that impact relationships in the 21st century. You will also learn important methods of strengthening current and future relationships.",202412,Family Science,Undergrad,1,Elise Resnick,40,28,12,0,2024-12-01
