id,title,description,term,department,level,sections,instructors,seats,open_seats,filled_seats,syllabus_count,term_cleaned
ENES221,Dynamics,"Prerequisite: Minimum grade of C- in ENES102; and (MATH141 and PHYS161).
Restriction: Must be in a major in ENGR-A. James Clark School of Engineering.",202412,Engineering Science,Undergrad,1,Patrick McAvoy,50,22,28,4,2024-12-01
ENES671,Legal Aspects of Entrepreneurship,Restriction: Must be in the Technology Entrepreneurship and Corporate Innovation Master of Professional Studies program; or permission of Maryland Technology Enterprise Institute.,202412,Engineering Science,Grad,1,Babak Akhlaghi,25,14,11,0,2024-12-01
ENES667,Market Development and Commercialization,Restriction: Must be in the Product Management or the Technology Entrepreneurship and Corporate Innovation Master of Professional Studies programs; or permission of Maryland Technology Enterprise Institute.,202412,Engineering Science,Grad,1,David Bosley,40,25,15,0,2024-12-01
ENES200,"Technology and Consequences: Engineering, Ethics and Humanity",Credit only granted for: ENEE200 or ENES200.,202412,Engineering Science,Undergrad,1,Leigha McReynolds,20,0,20,0,2024-12-01
ENES220,Mechanics II,"Prerequisite: Minimum grade of C- in ENES102; and (MATH141 and PHYS161).
Restriction: Must be in a major in ENGR-A. James Clark School of Engineering; and must not be in Engineering: Electrical program.",202412,Engineering Science,Undergrad,1,Andres Rubiano Acosta,50,26,24,5,2024-12-01
SPHL709,Reading Public Health Emergencies Through Information and Communication Research and Policy,"This course is an introduction for graduate students in any discipline to key theories, models, and findings on public health emergency public information and communication issues with a special focus on pandemics. The UMD faculty working on the Grand Challenge Pandemic Readiness Initiative (PRI) will provide readings and lead discussions to help students build foundational knowledge on information and communication issues for future coursework and research on public health emergencies. No prerequisites, open to all majors.",202412,Public Health,Grad,1,Cynthia Baur,20,14,6,0,2024-12-01
AASP187,"The New Jim Crow: African-Americans, Mass Incarceration and the Prison Industrial Complex",Recommended: AASP100.,202412,African American Studies,Undergrad,1,Robert Choflet,20,4,16,0,2024-12-01
AASP211,Get Out: The Sunken Place of Race Relations in the Post-Racial Era,"Credit only granted for: AASP298G or AASP211.
Formerly: AASP298G.",202412,African American Studies,Undergrad,1,Shane Walsh,20,1,19,0,2024-12-01
AASP498E,Special Topics in Black Culture; A Critical Understanding of Hip Hop Culture and its Impact on Society,"A critical exploration of Hip Hop and how it transcends race, socioeconomic background, culture, and gender.",202412,African American Studies,Undergrad,1,Solomon Comissiong,20,13,7,0,2024-12-01
AASP498Q,Special Topics in Black Culture; Black Discourse in Digital Media,"Examines the connections between black discourse, oral culture, and traditional media with new digital media technology. Various methods, theoretical approaches, and tools for studying social media and online communication.

Crosslisted with COMM498A. Credit only granted for COMM498A or AASP498Q.

Satisfies elective requirements for the Digital Studies in the Arts and Humanities (DSAH) graduate certificate.",202412,African American Studies,Undergrad,1,Rianna Walcott,30,25,5,0,2024-12-01
AASP230,Social (In)Justice and African-American Health and Well-Being,"African Americans suffer worse outcomes than non-Hispanic whites on nearly every health measure and outcomes that link to overall well-being like depressive symptoms or homicides. Health disparities are experienced by other underrepresented minority groups, but because of the unique historic and current experiences of African Americans, the determinants and solutions to African American health disparities are unique. The premise of this course is that African American health disparities are due to social injustices perpetuated on the institutional level that have permeated the lived experiences of African Americans leading to racial disparities in health and well-being. As such, the solutions on the both policy, and community, level must have a social justice approach.",202412,African American Studies,Undergrad,1,Ashley Newby,20,3,17,2,2024-12-01
AASP100,Introduction to African American Studies,"Significant aspects of the history of African Americans with particular emphasis on the evolution and development of black communities from slavery to the present. Interdisciplinary introduction to social, political, legal and economic roots of contemporary problems faced by blacks in the United States with applications to the lives of other racial and ethnic minorities in the Americas and in other societies.",202412,African American Studies,Undergrad,1,Jason Nichols,25,16,9,5,2024-12-01
AOSC123,Causes and Consequences of Global Change,"Cross-listed with: GEOL123.
Credit only granted for: AOSC123, GEOG123, or GEOL123.",202412,Atmospheric and Oceanic Science,Undergrad,1,Samantha Kemper,40,31,9,14,2024-12-01
AOSC200,Weather and Climate,"Prerequisite: MATH107, MATH110, or MATH115.
Recommended: Concurrent enrollment in AOSC201.",202412,Atmospheric and Oceanic Science,Undergrad,3,Jeffrey Henrikson,90,15,75,30,2024-12-01
AOSC201,Weather and Climate Laboratory,Corequisite: AOSC200.,202412,Atmospheric and Oceanic Science,Undergrad,2,Peter H'Doubler; Katharina Gallmeier; Jeffrey Henrikson; Sarah Loughran,60,2,58,0,2024-12-01
ARTT698A,Directed Graduate Studies in Studio Art,NA,202412,Art Studio,Grad,1,Justin Strom,1,1,0,0,2024-12-01
ARTT456,Motion Design,"Prerequisite: ARTT355, ARTT356, and ARTT357; or permission of ARHU-Art department.",202412,Art Studio,Undergrad,1,Antwon Key,15,8,7,0,2024-12-01
ARTT343,Elements of Printmaking: Screen Printing,"Prerequisite: ARTT200, ARTT210, and ARTT150; or permission of ARHU-Art department.",202412,Art Studio,Undergrad,1,Varvara Tokareva,15,9,6,0,2024-12-01
ARTT698B,Directed Graduate Studies in Studio Art,NA,202412,Art Studio,Grad,1,Shannon Collis,1,1,0,0,2024-12-01
ANTH742,Advanced Methods in CRM,Restriction: Must be in the Cultural and Heritage Resource Management Program (CHRM); or by permission of the Anthropology department.,202412,Anthropology,Grad,1,Lyle Torp,25,3,22,0,2024-12-01
ANTH607,Anthropology and Development,"Jointly offered with: ANTH407.
Credit only granted for: ANTH407 or ANTH607.",202412,Anthropology,Grad,1,Eduardo Fernandez; Christopher Hewlett,20,6,14,1,2024-12-01
ANTH386,Experiential Learning,"Recommended: Completion of advanced courses in relevant subfield of anthropology recommended.
Restriction: Permission of BSOS-Anthropology department; and junior standing or higher; and must be in Anthropology program.",202412,Anthropology,Undergrad,0,NA,0,0,0,0,2024-12-01
ANTH689A,Special Problems in Anthropology,NA,202412,Anthropology,Grad,0,NA,0,0,0,0,2024-12-01
ANTH469J,Advanced Special Topics in Cultural Anthropology; Educational Anthropology,"An exploration of the study of schools, and the roles of students, teachers, families and communities in constructing schooling, from an anthropological and ethnographic perspective.",202412,Anthropology,Undergrad,1,Jacqueline Messing,20,20,0,0,2024-12-01
ANTH260,Introduction to Sociocultural Anthropology and Linguistics,Culture and social relationships in a wide variety of settings from small-scale to complex societies. An overview of how anthropology analyzes human behavior. Particular attention to the relationship between language and culture.,202412,Anthropology,Undergrad,1,Melissa Stevens,25,18,7,4,2024-12-01
ANTH688J,Current Developments in Anthropology; Educational Anthropology,"An exploration of the study of schools, and the roles of students, teachers, families and communities in constructing schooling, from an anthropological and ethnographic perspective.",202412,Anthropology,Grad,1,Jacqueline Messing,20,19,1,0,2024-12-01
ANTH407,Anthropology and Development,"Jointly offered with: ANTH607.
Credit only granted for: ANTH407 or ANTH607.",202412,Anthropology,Undergrad,1,Eduardo Fernandez; Christopher Hewlett,20,18,2,1,2024-12-01
ANTH688F,"Current Developments in Anthropology; Immigration Policy, Immigrant Lives","An examination of the phenomenon of international migration, or immigration. Students develop awareness of how immigration has been framed in the general public and examined by social science disciplines, most prominently anthropology. Examination of case studies of different immigrant groups in distinct geographic contexts will illuminate the varied incorporation experiences of immigrants into U.S. society.",202412,Anthropology,Grad,1,Mai Alkhamissi,20,17,3,0,2024-12-01
ANTH398A,Independent Study,NA,202412,Anthropology,Undergrad,0,NA,0,0,0,0,2024-12-01
ANTH240,Introduction to Archaeology,"Exploration of the variety of past human societies and cultures through archaeology, from the emergence of anatomically modern humans to the more recent historical past.",202412,Anthropology,Undergrad,1,Joshua Samuels,25,18,7,5,2024-12-01
ANTH485,Honors Research Preparation,Restriction: Permission of BSOS-Anthropology department; and must be in Anthropology program; and must be admitted to University Honors Program or Anthropology Honors Program.,202412,Anthropology,Undergrad,0,NA,0,0,0,0,2024-12-01
ANTH358A,Undergraduate Teaching Assistant; Undergraduate Teaching Assistant in Archaeology,NA,202412,Anthropology,Undergrad,0,NA,0,0,0,0,2024-12-01
ANTH898,Pre-Candidacy Research,NA,202412,Anthropology,Grad,0,NA,0,0,0,0,2024-12-01
ANTH477,Senior Thesis,"Prerequisite: ANTH476.
Restriction: Permission of BSOS-Anthropology department; and must be in Anthropology program.
Credit only granted for: ANTH477 or ANTH487.",202412,Anthropology,Undergrad,0,NA,0,0,0,0,2024-12-01
ANTH744,"Collections, Data Management and Cultural Materials Preservation",Restriction: Must be in the Cultural and Heritage Resource Management Program (CHRM); or by permission of the Anthropology department.,202412,Anthropology,Grad,2,Hannah Smith,34,11,23,0,2024-12-01
ANTH712,Anthropology Internship Analysis,Prerequisite: ANTH789.,202412,Anthropology,Grad,0,NA,0,0,0,0,2024-12-01
ANTH266,"Changing Climate, Changing Cultures","Explore past, present, and future interactions between humans and climate. Discussions, methods-oriented activities, and case study analyses provide students a foundation for appreciating the role of anthropology in understanding, responding to, and preparing for climate change.",202412,Anthropology,Undergrad,1,Jana Kopelentova Rehak,30,1,29,0,2024-12-01
ANTH476,Senior Research,"Restriction: Must be in Anthropology program.
Credit only granted for: ANTH476 or ANTH486.",202412,Anthropology,Undergrad,0,NA,0,0,0,0,2024-12-01
ANTH749,Cultural and Heritage Resource Management Internship,NA,202412,Anthropology,Grad,1,Matthew Palus,20,19,1,0,2024-12-01
ANTH899,Doctoral Dissertation Research,NA,202412,Anthropology,Grad,0,NA,0,0,0,0,2024-12-01
ANTH789,Internship,NA,202412,Anthropology,Grad,0,NA,0,0,0,0,2024-12-01
ANTH265,Anthropology of Global Health,"An overview of the growing field of global health including health care systems, medical practices, ideas about illness in cross-cultural contexts, issues of health development, global health inequity, and human rights issues. The course will focus on the history of global health, the critique of major international health agencies and their development paradigms, and the political economy of social inequalities and health.",202412,Anthropology,Undergrad,1,Samantha Primiano,25,2,23,1,2024-12-01
ANTH463,Climate Cultures,"Climate change is an inherently global problem. To a significant degree, its causes and consequences are cultural in nature: Climate change impacts, mitigation and adaptation efforts are perceived and addressed in culture-specific ways. This course will be an overview of the holistic and anthropological approaches to the study of how culture frames what we know and how we respond to climate change. Readings, lectures, and discussions will focus on how culture is expressed through the interplay of processes and practices in specific economic, social and political contexts.",202412,Anthropology,Undergrad,1,Grit Martinez,20,17,3,1,2024-12-01
ANTH688C,Current Developments in Anthropology; Climate Cultures,NA,202412,Anthropology,Grad,1,Grit Martinez,20,20,0,0,2024-12-01
ANTH264,"Immigration Policy, Immigrant Lives","Cross-listed with: IMMR219C.
Credit only granted for: ANTH264 or IMMR219C.",202412,Anthropology,Undergrad,1,Mai Alkhamissi,20,9,11,1,2024-12-01
ANTH788,Internship Research,NA,202412,Anthropology,Grad,0,NA,0,0,0,0,2024-12-01
ANTH701,Anthropology Internship Preparation,"Preparation for internship includes practicum training in development, presentation and evaluation of position papers, proposals and work plans; literature search and use of secondary data sources in decision making the effect cultural analysis and resource management; ethics and professional development for work in non-academic settings.",202412,Anthropology,Grad,0,NA,0,0,0,0,2024-12-01
ANTH486,Honors Research,"Restriction: Permission of BSOS-Anthropology department; and must be in Anthropology program; and must be admitted to University Honors Program or Anthropology Honors Program.
Credit only granted for: ANTH486 or ANTH476.",202412,Anthropology,Undergrad,0,NA,0,0,0,0,2024-12-01
ANTH358B,Undergraduate Teaching Assistant; Undergraduate Teaching Assistant in Bio-Anthropology,NA,202412,Anthropology,Undergrad,5,Ampson Hagan; Joseph Richardson; Cady Gonzalez Valdivia; Emilia Guevara; Miguel Vilar,25,25,0,0,2024-12-01
ANTH222,Introduction to Ecological and Evolutionary Anthropology,Credit only granted for: ANTH220 or ANTH222.,202412,Anthropology,Undergrad,2,Elizabeth Veatch,40,4,36,5,2024-12-01
ANTH799,Master's Thesis Research; Cultural and Heritage Resource Management Thesis,NA,202412,Anthropology,Grad,1,Matthew Palus,20,4,16,0,2024-12-01
ANTH263,Sexuality and Culture,"Credit only granted for: ANTH298K or ANTH263.
Formerly: ANTH298K.",202412,Anthropology,Undergrad,1,Jeanne Hanna,25,9,16,1,2024-12-01
ANTH358C,Undergraduate Teaching Assistant; Undergraduate Teaching Assistant in Cultural Anthropology,NA,202412,Anthropology,Undergrad,5,Ampson Hagan; Joseph Richardson; Cady Gonzalez Valdivia; Emilia Guevara; Miguel Vilar,25,25,0,0,2024-12-01
ANTH487,Honors Thesis,"Prerequisite: ANTH486.
Restriction: Permission of BSOS-Anthropology department; and must be in Anthropology program; and must be admitted to University Honors Program or Anthropology Honors Program.
Credit only granted for: ANTH487 or ANTH477.",202412,Anthropology,Undergrad,0,NA,0,0,0,0,2024-12-01
PHIL100,Introduction to Philosophy,"An introduction to the literature, problems, and methods of philosophy either through a study of some of the main figures in philosophic thought or through an examination of some of the central and recurring problems of philosophy.",202412,Philosophy,Undergrad,1,Benjamin Fan,30,17,13,35,2024-12-01
PHIL245,Political and Social Philosophy I,"A critical examination of such classical political theories as those of Plato, Hobbes, Locke, Rousseau, Mill, Marx, and such contemporary theories as those of Hayek, Rawls, and recent Marxist thinkers.",202412,Philosophy,Undergrad,1,Zhaoqi Hu,30,24,6,11,2024-12-01
PHIL209T,It's About Time,NA,202412,Philosophy,Undergrad,1,Shen Pan,30,16,14,4,2024-12-01
PHIL202,Know Thyself: Wisdom Through Cognitive Science,"Credit only granted for: PHIL209N or PHIL202.
Formerly: PHIL209N.",202412,Philosophy,Undergrad,1,Michael McCourt,30,1,29,13,2024-12-01
NACS898,Pre-Candidacy Research,NA,202412,Neuroscience & Cognitive Science,Grad,14,Donald Bolger; Jens Herberholz; Ricardo Araneda; Evan Hart; Yasmeen Shah; Caroline Charpentier; Colenso Speer; Daniel Butts; Tracy Riggins; Melissa Caras; Anna Li; Michael Dougherty; Juan Angueyra-Aristizabal; Samira Anderson,15,2,13,0,2024-12-01
BIOM301,Introduction to Biometrics,Prerequisite: MATH113 or MATH115.,202412,Biometrics,Undergrad,1,Christine Hakenkamp,120,26,94,7,2024-12-01
CLAS170,Ancient Myths and Modern Lives,"Cross-listed with: RELS170.
Credit only granted for: CLAS170 or RELS170.
Additional information: This course cannot be taken for language credit.",202412,Classics,Undergrad,1,Edward Parker,35,11,24,0,2024-12-01
ENRE899,Doctoral Dissertation Research,NA,202412,Reliability Engineering,Grad,1,Mohammad Modarres,10,10,0,0,2024-12-01
ENRE489K,Special Topics in Reliability Engineering; Design for Reliability,Pre-requisite: Junior standing.,202412,Reliability Engineering,Undergrad,2,Reuel Smith,20,19,1,0,2024-12-01
THET888,Doctoral Practicum in Theatre,NA,202412,Theatre,Grad,0,NA,0,0,0,0,2024-12-01
THET285,The Art of Communication and Presentation,"Credit only granted for: COMM107, COMM200, INAG110, JOUR130, or THET285.",202412,Theatre,Undergrad,1,Melissa Sturges,15,9,6,0,2024-12-01
THET669C,Independent Study; Embodiment and Performance Technologies II,NA,202412,Theatre,Grad,1,Samuel Crawford,10,10,0,0,2024-12-01
THET669Y,Independent Study; The Wearable Art Design,NA,202412,Theatre,Grad,1,Helen Huang,5,2,3,0,2024-12-01
THET789,Theatre Design Process and Production,NA,202412,Theatre,Grad,4,Amith Chandrashaker; Instructor: TBA,14,13,1,0,2024-12-01
THET788,Design for Live Performance Tutorial,NA,202412,Theatre,Grad,3,Amith Chandrashaker; Misha Kachman; Instructor: TBA,16,14,2,0,2024-12-01
THET799,Master's Thesis Research and Preparation,NA,202412,Theatre,Grad,0,NA,0,0,0,0,2024-12-01
HESI318E,Applied Contextual Leadership; Exploring Strengths and Values for Effective Leadership,"Students will explore strengths and values of individuals and teams to better understand how to engage in effective, collaborative leadership. Tools such as the Gallup Organization's CliftonStrengths Assessment will be used with a critical lens. Themes of teamwork, problem-solving, diversity and inclusion, coaching others, and conflict resolution are woven throughout the course. (Students with previous credit for HESI418E Strengths-Based Leadership are not eligible to take this course. Contact leadershipstudies@umd.edu with questions.)",202412,"Higher Ed, Student Affairs, and International Ed Policy",Undergrad,1,Anastasia Lavrenyuk,20,13,7,0,2024-12-01
HISP319G,Special Topics in Historic Preservation; GIS for Historic Preservation,NA,202412,Historic Preservation,Undergrad,1,Stefan Woehlke,20,16,4,0,2024-12-01
HISP629,Independent Studies in Historic Preservation,NA,202412,Historic Preservation,Grad,0,NA,0,0,0,0,2024-12-01
HISP619G,Special Topics in Historic Preservation; GIS for the Built Environment,"GIS for Historic Preservation will provide students with the fundamental skills needed to use geographic information systems for a variety of applications within the heritage industries, including historic preservation, archaeology, and cultural resources management The coursewill begin with foundational skill building, including relational database basics, metadata creation, geographic coordinate systems and projections, spatial data types and their implications, feature creationand editing,data manipulation, and building spatial models for solving common challenges in preservation.",202412,Historic Preservation,Grad,1,Stefan Woehlke,20,14,6,0,2024-12-01
EMBA759,Independent Study,NA,202412,Executive MBA Program,Grad,2,Robert Sheehan,35,35,0,0,2024-12-01
NFSC100,Elements of Nutrition,"Credit only granted for: KNES264, KNES289F or NFSC100.",202412,Nutrition and Food Science,Undergrad,1,Margaret Udahogora,35,19,16,2,2024-12-01
NFSC799,Master's Thesis Research,NA,202412,Nutrition and Food Science,Grad,0,NA,0,0,0,0,2024-12-01
NFSC386,Experiential Learning,"Prerequisite: Permission of AGNR-Nutrition and Food Science department.
Restriction: Junior standing or higher.
Formerly: FDSC386 and NUTR386.",202412,Nutrition and Food Science,Undergrad,0,NA,0,0,0,0,2024-12-01
NFSC899,Doctoral Dissertation Research,NA,202412,Nutrition and Food Science,Grad,1,Instructor: TBA,1,1,0,0,2024-12-01
NFSC699,Problems in Nutrition and Food Science,NA,202412,Nutrition and Food Science,Grad,0,NA,0,0,0,0,2024-12-01
NFSC498,Selected Topics,NA,202412,Nutrition and Food Science,Undergrad,0,NA,0,0,0,1,2024-12-01
BIOE241,Biocomputational Methods,Restriction: Permission of ENGR-Fischell Department of Bioengineering department.,202412,Bioengineering,Undergrad,1,Kyung Koh,20,0,20,0,2024-12-01
BIOE447,Clinical Experiences in Bioengineering,"Prerequisite: BIOE221.
Restriction: Permission of ENGR-Fischell Department of Bioengineering department.
Credit only granted for: BIOE489O or BIOE447.
Formerly: BIOE489O.",202412,Bioengineering,Undergrad,1,Giuliano Scarcelli,15,4,11,0,2024-12-01
BIOE489X,Special Topics in Bioengineering; Primary Literature in Genome Editing,"Prereqs: BIOE120, BIOE121, BSCI330

The course will introduce students to the field of genome editing. After reviewing basic molecular biology concepts necessary to engage with the material, the course will explore the relevant cutting-edge technologies via in-depth analysis of the primary literature, both historically important and recent landmark papers.",202412,Bioengineering,Undergrad,1,Jarred Callura,20,13,7,0,2024-12-01
MUSC205,"History of Popular Music, 1950-Present","A historical survey of rock music (blues, rock, soul, metal, rap, etc.) from circa 1950 to the present, with emphasis on popular music as music and popular music as social history.",202412,School of Music,Undergrad,1,Nathaniel Harrell,55,2,53,3,2024-12-01
MUSC140,Music Fundamentals I,Restriction: Must not be in any of the following programs (Music (Professional Program); Music Education).,202412,School of Music,Undergrad,1,Sean Klink,20,11,9,2,2024-12-01
MUSC204,Popular Music in Black America,"Traces black popular music in the U.S. with a special focus on spirituals, ragtime, the blues, early jazz, R&B, Motown, funk, soul, and rap. Examines how these styles have been borrowed by the American music industry.",202412,School of Music,Undergrad,1,Nicole Steinberg,50,30,20,1,2024-12-01
PLCY798A,Readings in Public Policy,NA,202412,Public Policy,Grad,0,NA,0,0,0,0,2024-12-01
PLCY201,Public Leaders and Active Citizens,"Credit only granted for: PLCY201 or PUAF201.
Formerly: PUAF201.",202412,Public Policy,Undergrad,1,Anne Kaiser,25,15,10,12,2024-12-01
PLCY752,Managing Differences:Resolving Conflict and Negotiating Agreements,"Restriction: Must be in a major in PLCY-School of Public Policy; or permission of PLCY-School of Public Policy.
Credit only granted for: PLCY752 or PUAF752.
Formerly: PUAF752.",202412,Public Policy,Grad,2,Mark Graham,25,10,15,0,2024-12-01
PLCY698W,Selected Topics in Public Affairs; Professional Gaming,"This course covers gaming as a professional practice and prepares students to apply associated methodologies. The term gaming applied here addresses sponsored objectives and decision support rather than commercial and/or entertainment value familiar to most people. Many US Government programs regularly include gaming approaches (eg, table top exercises, wargames) as a method of addressing critical challenges, sorting through complex qualitative factors or driving collaboration across disparate groups. Interagency and international applications are becoming common place but require special attention to cultural and social factors. Students will learn to influence strategic decision making, course of action examination and critical thinking through gaming while providing empirical support for stakeholder priorities, policy development and complex interactions.",202412,Public Policy,Grad,2,Scott Simpkins,25,18,7,0,2024-12-01
BIOL708F,Advanced Topics in Biology; Infectious Disease Dynamics: A Systems Approach,"Credit only granted for: BIOL708F or BSCI439C.

Understanding and controlling the dynamics of infectious diseases remain challenging since factors that drive dynamics are highly interrelated, ranging from host-pathogen interactions, the impact of the nvironment, and human factors like communication, individual behavior, and surveillance. In this course, we will introduce systems thinking as a tool to characterize interaction networks that impact population-level disease dynamics. We will discuss their use for building strategies of disease prevention and mitigation for a range of diseases in human and environmental contexts, and learn to develop and run systems-informed epidemiological simulations.",202412,Biology,Grad,1,Stephen Beckett; Gabi Steinbach,10,7,3,0,2024-12-01
KNES689,Special Problems in Kinesiology,NA,202412,Kinesiology,Grad,0,NA,0,0,0,0,2024-12-01
KNES161T,Physical Education Activities: Coed; Yoga (Beginning),Students must pay a $40 instructional materials fee.,202412,Kinesiology,Undergrad,1,Kate Shin,30,0,30,0,2024-12-01
KNES334,Adapted Physical Activity: Empowering People with Disabilities to Lead a Healthy and Active Lifestyle,"Prerequisite: KNES370; or students not in the Kinesiology major may contact the instructor for permission.
Restriction: Must have earned a minimum of 75 credits.",202412,Kinesiology,Undergrad,1,Ana Palla,30,0,30,0,2024-12-01
KNES498,Special Topics in Kinesiology,Prerequisite: permission of department.,202412,Kinesiology,Undergrad,0,NA,0,0,0,0,2024-12-01
KNES899,Doctoral Dissertation Research,NA,202412,Kinesiology,Grad,0,NA,0,0,0,0,2024-12-01
KNES289,Topical Investigations,Prerequisite: permission of department.,202412,Kinesiology,Undergrad,0,NA,0,0,0,0,2024-12-01
KNES354,Sports Finance & Business Intelligence,"Prerequisite: At least 1 course from the Kinesiology core courses at the 300-level or higher completed with a minimum grade of C-.
Restriction: Must have earned a minimum of 75 credits.
Credit only granted for: KNES243 or KNES354.
Formerly: KNES243.",202412,Kinesiology,Undergrad,1,Thomas Nagle,30,22,8,0,2024-12-01
